{
  "city_id": "BUR-16",
  "slug": "bursa",
  "country_id": "TR",
  "name": {
    "tr": "Bursa",
    "en": "Bursa"
  },
  "timezone": "Europe/Istanbul",
  "center": {
    "lat": 40.195,
    "lon": 29.0601
  },
  "default_zoom": 12,
  "population": 3147818,
  "region_code": "16",
  "website": "https://www.bursa.bel.tr",
  "open_data_url": "https://opendata.bursa.bel.tr",
  "updated_at": "2026-09-22T10:00:00Z"
}
